No.     Time           Source                Destination           Protocol Length Info
     10 14.390274445   192.168.133.134       192.168.133.128       HTTP     322    GET //K2KmaS.cD/HGgWeoGl/Gh.I4/RnIxh4B9Rubq2QlMv9omsEaANMg0kBQMT4kWpECuKhkjUfWiMr9qeJ0qZ6Q3Fx6/akyYSnYBYOG6JmWsE1PiWgl.Wyw8qSOCpG3v4pu7zrIPvIOfDNSbfbTR7G0n/wz5cecbx1xvHjdwqbDHqMIULsXEKNlob/j.IJW4SYw4s9iSjLuJ1zANgOtRgruaMpVvo11B3UiErePOFI0aZsx. HTTP/1.1 

Frame 10: 322 bytes on wire (2576 bits), 322 bytes captured (2576 bits) on interface 0
Ethernet II, Src: Vmware_37:bb:e5 (00:0c:29:37:bb:e5), Dst: Vmware_51:c3:5c (00:0c:29:51:c3:5c)
Internet Protocol Version 4, Src: 192.168.133.134, Dst: 192.168.133.128
Transmission Control Protocol, Src Port: 41268, Dst Port: 8080, Seq: 1, Ack: 1, Len: 256
Hypertext Transfer Protocol

No.     Time           Source                Destination           Protocol Length Info
     12 14.400531849   192.168.133.134       192.168.133.128       HTTP     322    GET /GmDPceEikgCh/SbTiJbZRI8iiOeONI9A.zqMLpsDkOEo3.K/KPcZuvWZx/589X3u7k8uWgGtgpOI05ishv/GKVmkjMEe48qhfIQkQCRhAvw0ESo36AfwT9FZJSBSc90QKiyMsT7sstimv5ptN332DlPiRgyKpf.PqY9ZEo6GKk/DXRJMCVB4PTs9XSOHk7KMMxH9v8VrSThVv2KpPV4X.ayUSvdqCRvvMDOS.IAGiDwMHf HTTP/1.1 

Frame 12: 322 bytes on wire (2576 bits), 322 bytes captured (2576 bits) on interface 0
Ethernet II, Src: Vmware_37:bb:e5 (00:0c:29:37:bb:e5), Dst: Vmware_51:c3:5c (00:0c:29:51:c3:5c)
Internet Protocol Version 4, Src: 192.168.133.134, Dst: 192.168.133.128
Transmission Control Protocol, Src Port: 41268, Dst Port: 8080, Seq: 257, Ack: 1, Len: 256
Hypertext Transfer Protocol

No.     Time           Source                Destination           Protocol Length Info
     20 14.429339037   192.168.133.134       192.168.133.128       HTTP     322    GET //5H4zHgDz5Fmvr8yG1WfEmSTpARl6H07/lMbKe1kQV1qdGpaWHWGmtqqZnhrs2kreLHJHSbtCrzLBWVw49lDdA4mDcRw39ZmJaqrSMebdnwXqR8VY0f/FBx6Ci11XXtZj.OHFFK4Fm4p/1IVbhy0fPuOS8C4JfesvYdbNXHAIriFntAp932ww/FPMqNG2VaTVnqH12oIJ4Ns1998AnyD2Nfq7M6pFxkC7R93/cGWLEYo7D HTTP/1.1 

Frame 20: 322 bytes on wire (2576 bits), 322 bytes captured (2576 bits) on interface 0
Ethernet II, Src: Vmware_37:bb:e5 (00:0c:29:37:bb:e5), Dst: Vmware_51:c3:5c (00:0c:29:51:c3:5c)
Internet Protocol Version 4, Src: 192.168.133.134, Dst: 192.168.133.128
Transmission Control Protocol, Src Port: 41268, Dst Port: 8080, Seq: 513, Ack: 257, Len: 256
Hypertext Transfer Protocol

No.     Time           Source                Destination           Protocol Length Info
     26 14.635728439   192.168.133.134       192.168.133.128       HTTP     322    GET //4f0/lXBijrZPufN.MXP4WNThyLXWPUM.ssbtF7m.cLrL2BzhVUERRlR3SXj2nrjEYOZtz.eyyrhruPjhsptcvH0SpqiU0/wJypUKzMSoyu/Az2af83/.LDe4W9MbcdAlIvRyzFc2DVrOJP0CCP5nPwNOetJK2uaJHeYWnHXSAJXp.MkDRhsgYiQgfLKRx4Kn0Ttz.HcPPl7IyFTpbM390G.kVFdr7XcNrd12ROSburCoi HTTP/1.1 

Frame 26: 322 bytes on wire (2576 bits), 322 bytes captured (2576 bits) on interface 0
Ethernet II, Src: Vmware_37:bb:e5 (00:0c:29:37:bb:e5), Dst: Vmware_51:c3:5c (00:0c:29:51:c3:5c)
Internet Protocol Version 4, Src: 192.168.133.134, Dst: 192.168.133.128
Transmission Control Protocol, Src Port: 41268, Dst Port: 8080, Seq: 769, Ack: 513, Len: 256
Hypertext Transfer Protocol

No.     Time           Source                Destination           Protocol Length Info
     28 14.636533666   192.168.133.128       198.11.132.23         HTTP     129    GET / HTTP/1.1 

Frame 28: 129 bytes on wire (1032 bits), 129 bytes captured (1032 bits) on interface 0
Ethernet II, Src: Vmware_51:c3:5c (00:0c:29:51:c3:5c), Dst: Vmware_e7:51:18 (00:50:56:e7:51:18)
Internet Protocol Version 4, Src: 192.168.133.128, Dst: 198.11.132.23
Transmission Control Protocol, Src Port: 40844, Dst Port: 80, Seq: 1, Ack: 1, Len: 75
Hypertext Transfer Protocol

No.     Time           Source                Destination           Protocol Length Info
     30 14.829623649   198.11.132.23         192.168.133.128       HTTP     626    HTTP/1.1 302 Found  (text/html)

Frame 30: 626 bytes on wire (5008 bits), 626 bytes captured (5008 bits) on interface 0
Ethernet II, Src: Vmware_e7:51:18 (00:50:56:e7:51:18), Dst: Vmware_51:c3:5c (00:0c:29:51:c3:5c)
Internet Protocol Version 4, Src: 198.11.132.23, Dst: 192.168.133.128
Transmission Control Protocol, Src Port: 80, Dst Port: 40844, Seq: 1, Ack: 76, Len: 572
Hypertext Transfer Protocol
Line-based text data: text/html

No.     Time           Source                Destination           Protocol Length Info
     36 14.838385712   192.168.133.134       192.168.133.128       HTTP     322    GET //GjM0rB8Qd/TDA5UrXRC7NcMVyDRFAblMtzoTv1AxiQOexbwGGvYhlqALh65qySZAFDY6GFGO2CvQRsUIrsvXW.YDU0557BnFTgsPP9Pz003BNkKEyXoo9sKdPqsQBSagNKBHUG6men0cz19LxB4xALb3KW6IN1MEkDcGv2Xt1J0qtOiWkMjoW9SKtn6fdEqiEQNWUKoTCuCgwZm2je0vhbkxB0xoE4KCBP.M3dEa1Md/n HTTP/1.1 

Frame 36: 322 bytes on wire (2576 bits), 322 bytes captured (2576 bits) on interface 0
Ethernet II, Src: Vmware_37:bb:e5 (00:0c:29:37:bb:e5), Dst: Vmware_51:c3:5c (00:0c:29:51:c3:5c)
Internet Protocol Version 4, Src: 192.168.133.134, Dst: 192.168.133.128
Transmission Control Protocol, Src Port: 41272, Dst Port: 8080, Seq: 1, Ack: 1, Len: 256
Hypertext Transfer Protocol

No.     Time           Source                Destination           Protocol Length Info
     38 14.839930883   192.168.133.134       192.168.133.128       HTTP     322    GET /TR7vUhi8kRh5tGx/7Pvs7trzjP9azYbPhBkd6OoN0932I1tuNAftvhYUTMdlEfCGyVchosePEXdKTmP99kfpwRghk6QdzVBI4jnmj5JV7MyW.Igu/6V9N0iGvaDj71XyV2xyOd/T.4iEoS7ZrDekh3.Vt8CqO4HhYjmZyZPqAvLTAR9tnE0P.FtF5EJkJLvaqMGC1B/EOH76Sg1EJtzYz9feeiJ20asysbwG8yP82m9RFf HTTP/1.1 

Frame 38: 322 bytes on wire (2576 bits), 322 bytes captured (2576 bits) on interface 0
Ethernet II, Src: Vmware_37:bb:e5 (00:0c:29:37:bb:e5), Dst: Vmware_51:c3:5c (00:0c:29:51:c3:5c)
Internet Protocol Version 4, Src: 192.168.133.134, Dst: 192.168.133.128
Transmission Control Protocol, Src Port: 41272, Dst Port: 8080, Seq: 257, Ack: 1, Len: 256
Hypertext Transfer Protocol

No.     Time           Source                Destination           Protocol Length Info
     46 14.869950975   192.168.133.134       192.168.133.128       HTTP     322    GET /GeN45VCjb.kZNJesl39oAKUaw49KufzytwTtATSR3N3gedj9H.ZaGXqOHibK3i9iudLHZ39huEJHm0To4GGaLXnTabKzlzHC/5.LM3ZdKNyrFKQKzJidc5gyBx2FojYhHnJLsgRV.71ELgUIiTvH3EMROVjwj3MJqhOw2cH7ACPxNYIMIE0ODP0OoNi2Qv2wvh6BIJRs41TC/4gityECdUhYcL17KKoEHkcn6AjX9J6dST HTTP/1.1 

Frame 46: 322 bytes on wire (2576 bits), 322 bytes captured (2576 bits) on interface 0
Ethernet II, Src: Vmware_37:bb:e5 (00:0c:29:37:bb:e5), Dst: Vmware_51:c3:5c (00:0c:29:51:c3:5c)
Internet Protocol Version 4, Src: 192.168.133.134, Dst: 192.168.133.128
Transmission Control Protocol, Src Port: 41272, Dst Port: 8080, Seq: 513, Ack: 257, Len: 256
Hypertext Transfer Protocol

No.     Time           Source                Destination           Protocol Length Info
     54 15.004750593   192.168.133.134       192.168.133.128       HTTP     322    GET /Gvzc1f87ZgOZmVX4w8s9n5xEAW4ajYmA2aEMkzLAHKB0RkcMaW2y3Zxz0aZQRbdytXUsHUL626bLz9ZI8cykDbNb.3Af5LtugxejheThrHBjXjIWBS7X5KJNfZUniXJoAO5CDWS6ufKoaOe56.scCCrwJgxNi6fZeQEseSU6gQcqOnt8GssnQFznKMtI5w76VxvvCqO.fzd2AqRFUD9fBnYLuZOKfXtK6R4Boypvh7udNq HTTP/1.1 

Frame 54: 322 bytes on wire (2576 bits), 322 bytes captured (2576 bits) on interface 0
Ethernet II, Src: Vmware_37:bb:e5 (00:0c:29:37:bb:e5), Dst: Vmware_51:c3:5c (00:0c:29:51:c3:5c)
Internet Protocol Version 4, Src: 192.168.133.134, Dst: 192.168.133.128
Transmission Control Protocol, Src Port: 41272, Dst Port: 8080, Seq: 769, Ack: 513, Len: 256
Hypertext Transfer Protocol

No.     Time           Source                Destination           Protocol Length Info
     56 15.005491335   192.168.133.128       72.21.210.29          HTTP     131    GET / HTTP/1.1 

Frame 56: 131 bytes on wire (1048 bits), 131 bytes captured (1048 bits) on interface 0
Ethernet II, Src: Vmware_51:c3:5c (00:0c:29:51:c3:5c), Dst: Vmware_e7:51:18 (00:50:56:e7:51:18)
Internet Protocol Version 4, Src: 192.168.133.128, Dst: 72.21.210.29
Transmission Control Protocol, Src Port: 46668, Dst Port: 80, Seq: 1, Ack: 1, Len: 77
Hypertext Transfer Protocol

No.     Time           Source                Destination           Protocol Length Info
     58 15.128438463   72.21.210.29          192.168.133.128       HTTP     488    HTTP/1.1 301 Moved Permanently  (text/html)

Frame 58: 488 bytes on wire (3904 bits), 488 bytes captured (3904 bits) on interface 0
Ethernet II, Src: Vmware_e7:51:18 (00:50:56:e7:51:18), Dst: Vmware_51:c3:5c (00:0c:29:51:c3:5c)
Internet Protocol Version 4, Src: 72.21.210.29, Dst: 192.168.133.128
Transmission Control Protocol, Src Port: 80, Dst Port: 46668, Seq: 1, Ack: 78, Len: 434
Hypertext Transfer Protocol
Line-based text data: text/html

No.     Time           Source                Destination           Protocol Length Info
     64 15.132923141   192.168.133.134       192.168.133.128       HTTP     322    GET /EJXvEiQ4mD8FF/J.JECyhcd6XY52PDGZBbdfQ7gcrpeCkaZ46lHr7rTujoBbrcDy4SA.D7hAAQl7532OGfc2U5Y.GvCxVe2VW7l9UEH4IkMYxmxIeixrO2m7A2ZRTHxi5gcMe9lRF7rEW0PabWPo1AEO6jTk8Jy9ZnuYSsa7WIMAWGH0Q8lQURtQL5G2phSNuOMYhj/ciju/8y5.BS6uUpH8T4HsrPJgItf7xflwqUKeuW HTTP/1.1 

Frame 64: 322 bytes on wire (2576 bits), 322 bytes captured (2576 bits) on interface 0
Ethernet II, Src: Vmware_37:bb:e5 (00:0c:29:37:bb:e5), Dst: Vmware_51:c3:5c (00:0c:29:51:c3:5c)
Internet Protocol Version 4, Src: 192.168.133.134, Dst: 192.168.133.128
Transmission Control Protocol, Src Port: 41276, Dst Port: 8080, Seq: 1, Ack: 1, Len: 256
Hypertext Transfer Protocol

No.     Time           Source                Destination           Protocol Length Info
     66 15.133900753   192.168.133.134       192.168.133.128       HTTP     322    GET //NTDQVtfNQGjMKDRcDbNjSG3yZiFUGo5jEHWp3jFP95K5QChGpt62oIkADagtscCQI7K2sAYZs3SCji0PPM/eqeWnNm3X./ixslk/q3PuCM58.rpcmI1VrZ2PDNiaXuDNvrRURshEKsS6Xt./uaLuOG7B7pUxx/fn62k/XYrPflrx4qCa8W3lp1eXIyB1tJmOMqXi5uFJf/htRWdZqyI5fb8JZJNtms8FTZUSGtQlwi03i HTTP/1.1 

Frame 66: 322 bytes on wire (2576 bits), 322 bytes captured (2576 bits) on interface 0
Ethernet II, Src: Vmware_37:bb:e5 (00:0c:29:37:bb:e5), Dst: Vmware_51:c3:5c (00:0c:29:51:c3:5c)
Internet Protocol Version 4, Src: 192.168.133.134, Dst: 192.168.133.128
Transmission Control Protocol, Src Port: 41276, Dst Port: 8080, Seq: 257, Ack: 1, Len: 256
Hypertext Transfer Protocol

No.     Time           Source                Destination           Protocol Length Info
     75 15.180068543   192.168.133.134       192.168.133.128       HTTP     322    GET //wHk0PRHJUMfKBvHnW7YvcfplYlYiw.J99IrE8nSNHB7XUPvTOs1/QsPYO5KbJDmV0P28PiiUxPDA/f0pXmQYjag3.LoYU1hHqfPU687j1KUWLR/xzYI9VwNKDV.kH8R9idHERrwkKCXt5iGwXv2cDyyy.76.XCV8AK/KBpEFoJnvGnvnbA8/f2T8h.QbTgebLZ/7ZgjA77mvAlF0mTKfAIbu.uzE0URx6ruOuGXSNBBxf HTTP/1.1 

Frame 75: 322 bytes on wire (2576 bits), 322 bytes captured (2576 bits) on interface 0
Ethernet II, Src: Vmware_37:bb:e5 (00:0c:29:37:bb:e5), Dst: Vmware_51:c3:5c (00:0c:29:51:c3:5c)
Internet Protocol Version 4, Src: 192.168.133.134, Dst: 192.168.133.128
Transmission Control Protocol, Src Port: 41276, Dst Port: 8080, Seq: 513, Ack: 257, Len: 256
Hypertext Transfer Protocol

No.     Time           Source                Destination           Protocol Length Info
     82 15.227353948   192.168.133.134       192.168.133.128       HTTP     322    GET /Grh3A1O7CiVdO87aPnUk.r.GdIyC55fgj3aS3dj7kQ8OSn99I6rxrQFokwcCb6u5k4YyPL94r4l7mW5R4ghZxxD/Vtzs66im8xRfAh2tHsDp36ZRLh/ZeGSXpzaO9YJ6I1DMOjZvJzaKC1cxawP/nxYpD9I1l7usdvixk58mCzJbTQ.n3wuDrXGElS90FHyXMjg84W6f6iThawEoK.Gf3KUzdIVy6HC2YM5F9SgI8naz/q HTTP/1.1 

Frame 82: 322 bytes on wire (2576 bits), 322 bytes captured (2576 bits) on interface 0
Ethernet II, Src: Vmware_37:bb:e5 (00:0c:29:37:bb:e5), Dst: Vmware_51:c3:5c (00:0c:29:51:c3:5c)
Internet Protocol Version 4, Src: 192.168.133.134, Dst: 192.168.133.128
Transmission Control Protocol, Src Port: 41276, Dst Port: 8080, Seq: 769, Ack: 513, Len: 256
Hypertext Transfer Protocol

No.     Time           Source                Destination           Protocol Length Info
     84 15.228613261   192.168.133.128       151.101.128.81        HTTP     127    GET / HTTP/1.1 

Frame 84: 127 bytes on wire (1016 bits), 127 bytes captured (1016 bits) on interface 0
Ethernet II, Src: Vmware_51:c3:5c (00:0c:29:51:c3:5c), Dst: Vmware_e7:51:18 (00:50:56:e7:51:18)
Internet Protocol Version 4, Src: 192.168.133.128, Dst: 151.101.128.81
Transmission Control Protocol, Src Port: 58978, Dst Port: 80, Seq: 1, Ack: 1, Len: 73
Hypertext Transfer Protocol

No.     Time           Source                Destination           Protocol Length Info
     86 15.249408702   151.101.128.81        192.168.133.128       HTTP     407    HTTP/1.1 301 Moved Permanently 

Frame 86: 407 bytes on wire (3256 bits), 407 bytes captured (3256 bits) on interface 0
Ethernet II, Src: Vmware_e7:51:18 (00:50:56:e7:51:18), Dst: Vmware_51:c3:5c (00:0c:29:51:c3:5c)
Internet Protocol Version 4, Src: 151.101.128.81, Dst: 192.168.133.128
Transmission Control Protocol, Src Port: 80, Dst Port: 58978, Seq: 1, Ack: 74, Len: 353
Hypertext Transfer Protocol

No.     Time           Source                Destination           Protocol Length Info
     92 15.253242675   192.168.133.134       192.168.133.128       HTTP     322    GET /THAksE0zBbGjLGsZqHhCQ2eeeR09JZ6twMO7D7j/J2WMiVIbORW4cA5glz8EcFRu9zc7V2eld5URu3/JTUatd9QF8cj2L1cgloW8x8OIgFEjpdb8FeA/5Sa/SyChp1r6nY5luZ0W9pe4IXh5jm0e0C5mGaanmiy4VfGnSQMLEJO.vYQWWAOcKd2qYLTvZMyNv0l9znQyldISnGZlk0iJmqyIp.qmzX/fSRQpBGSDCdte1g HTTP/1.1 

Frame 92: 322 bytes on wire (2576 bits), 322 bytes captured (2576 bits) on interface 0
Ethernet II, Src: Vmware_37:bb:e5 (00:0c:29:37:bb:e5), Dst: Vmware_51:c3:5c (00:0c:29:51:c3:5c)
Internet Protocol Version 4, Src: 192.168.133.134, Dst: 192.168.133.128
Transmission Control Protocol, Src Port: 41280, Dst Port: 8080, Seq: 1, Ack: 1, Len: 256
Hypertext Transfer Protocol

No.     Time           Source                Destination           Protocol Length Info
     94 15.254234980   192.168.133.134       192.168.133.128       HTTP     322    GET //2R6ljPKjlUmosLcIu.6pKsUxhpGFhvU4X9W2SDVWXbpJkyTN/nufn6jqLwVJRHkv6cjefQjbkBx3be/ccI6D03MRdCDqK83DDzqkCXjYxHbIYad.qdPv/5RwnT2ge.1PSiPh4C/Nu7GI9n6G2rBCtw.WKseSyzmNxQ4cnqXWw9b234kffNdBspRBDCYPotAH8t2Ay3I1xZdmPKM/54FYyMdbEYlMvGL8Ie9WXAtOX5RhS HTTP/1.1 

Frame 94: 322 bytes on wire (2576 bits), 322 bytes captured (2576 bits) on interface 0
Ethernet II, Src: Vmware_37:bb:e5 (00:0c:29:37:bb:e5), Dst: Vmware_51:c3:5c (00:0c:29:51:c3:5c)
Internet Protocol Version 4, Src: 192.168.133.134, Dst: 192.168.133.128
Transmission Control Protocol, Src Port: 41280, Dst Port: 8080, Seq: 257, Ack: 1, Len: 256
Hypertext Transfer Protocol

No.     Time           Source                Destination           Protocol Length Info
    105 15.273985637   192.168.133.134       192.168.133.128       HTTP     322    GET /G2KMLGcJDvyNxR4LgcfpBCaXbuwlBFjC3hspXKTfIPK/k66KnPmeg6hYoMoXL3zk9aY6AafVpwHC.KSihvXpuj/lzJ6SCt1W5pn36OwZ2YoihNm4IB5r1ONIb9AOU9b1aFSIek83WqlhdAqRPWN4k.PXPl.xNmDIOG8uE9aj3Ng1EXHFaHmmnENbrymNAdGZ58uzMa9Sdq1ep8DeWPsNdhxaOE7KNMyI7bNrotFJcFQR9S HTTP/1.1 

Frame 105: 322 bytes on wire (2576 bits), 322 bytes captured (2576 bits) on interface 0
Ethernet II, Src: Vmware_37:bb:e5 (00:0c:29:37:bb:e5), Dst: Vmware_51:c3:5c (00:0c:29:51:c3:5c)
Internet Protocol Version 4, Src: 192.168.133.134, Dst: 192.168.133.128
Transmission Control Protocol, Src Port: 41280, Dst Port: 8080, Seq: 513, Ack: 257, Len: 256
Hypertext Transfer Protocol

No.     Time           Source                Destination           Protocol Length Info
    111 15.315152666   192.168.133.134       192.168.133.128       HTTP     322    GET /TBi8Re01fbIGTjBgI4tTWePWWxZ6cwPK172bsUNWfJ426sMsjJUvKGHkCURXhvEhW14ft1kyxYd7ChGJSgP91o/Lke04KFc4b73HKKDRQWd.dnC0RSVwMO3i5BG8oru9HWw5ua6xXKdje9J4NT84cNAIvtj8Xvz1T7ByD/GQwbNzGkfFq5vyE8I7c39IWe7VFGv29T3et7hy4XXqcDEbGQwsHOouhZNgnoDlzm.wRtryvS HTTP/1.1 

Frame 111: 322 bytes on wire (2576 bits), 322 bytes captured (2576 bits) on interface 0
Ethernet II, Src: Vmware_37:bb:e5 (00:0c:29:37:bb:e5), Dst: Vmware_51:c3:5c (00:0c:29:51:c3:5c)
Internet Protocol Version 4, Src: 192.168.133.134, Dst: 192.168.133.128
Transmission Control Protocol, Src Port: 41280, Dst Port: 8080, Seq: 769, Ack: 513, Len: 256
Hypertext Transfer Protocol

No.     Time           Source                Destination           Protocol Length Info
    112 15.316017644   192.168.133.128       204.79.197.200        HTTP     126    GET / HTTP/1.1 

Frame 112: 126 bytes on wire (1008 bits), 126 bytes captured (1008 bits) on interface 0
Ethernet II, Src: Vmware_51:c3:5c (00:0c:29:51:c3:5c), Dst: Vmware_e7:51:18 (00:50:56:e7:51:18)
Internet Protocol Version 4, Src: 192.168.133.128, Dst: 204.79.197.200
Transmission Control Protocol, Src Port: 41252, Dst Port: 80, Seq: 1, Ack: 1, Len: 72
Hypertext Transfer Protocol

No.     Time           Source                Destination           Protocol Length Info
    114 15.330087720   192.168.133.128       192.168.133.134       HTTP     66     HTTP/1.1 200 OK  (h)

Frame 114: 66 bytes on wire (528 bits), 66 bytes captured (528 bits) on interface 0
Ethernet II, Src: Vmware_51:c3:5c (00:0c:29:51:c3:5c), Dst: Vmware_37:bb:e5 (00:0c:29:37:bb:e5)
Internet Protocol Version 4, Src: 192.168.133.128, Dst: 192.168.133.134
Transmission Control Protocol, Src Port: 8080, Dst Port: 41276, Seq: 950, Ack: 1025, Len: 0
[4 Reassembled TCP Segments (949 bytes): #68(256), #80(256), #88(437), #114(0)]
Hypertext Transfer Protocol
Media Type

No.     Time           Source                Destination           Protocol Length Info
    115 15.348295720   204.79.197.200        192.168.133.128       HTTP     308    HTTP/1.1 301 Moved Permanently 

Frame 115: 308 bytes on wire (2464 bits), 308 bytes captured (2464 bits) on interface 0
Ethernet II, Src: Vmware_e7:51:18 (00:50:56:e7:51:18), Dst: Vmware_51:c3:5c (00:0c:29:51:c3:5c)
Internet Protocol Version 4, Src: 204.79.197.200, Dst: 192.168.133.128
Transmission Control Protocol, Src Port: 80, Dst Port: 41252, Seq: 1, Ack: 73, Len: 254
Hypertext Transfer Protocol

No.     Time           Source                Destination           Protocol Length Info
    123 15.360734656   192.168.133.134       192.168.133.128       HTTP     322    GET /EYUJB4lzkfX./BgQEsl5VgYtuoVAqsmR9QOjEPWL2KI2RB9pK32aeuWb4jfZwNmiOWEu5dRF2H2gm9ynVz1QDc17EjBSJtKr9QunEx5ASLigsmWeKpBxoWTo4TyLYHiWgl.Hfy6W6mOmw/qfJVtFDRANyvJz7HTT2HIYH8p/JtW2a/X987Acjo8bqF0Vxyn9nMJM.2pibcrxmbB1z/XxiDKBvdEzW65wMBJ/HsRuLHYICc HTTP/1.1 

Frame 123: 322 bytes on wire (2576 bits), 322 bytes captured (2576 bits) on interface 0
Ethernet II, Src: Vmware_37:bb:e5 (00:0c:29:37:bb:e5), Dst: Vmware_51:c3:5c (00:0c:29:51:c3:5c)
Internet Protocol Version 4, Src: 192.168.133.134, Dst: 192.168.133.128
Transmission Control Protocol, Src Port: 41284, Dst Port: 8080, Seq: 1, Ack: 1, Len: 256
Hypertext Transfer Protocol

No.     Time           Source                Destination           Protocol Length Info
    125 15.361366695   192.168.133.134       192.168.133.128       HTTP     322    GET /GC2wqiI57R/a9vr23NnCWbpBIhVIxggHZYRKmt2JckmE00QpVQ2UWx56Ht8Z1AdtYB6BAS6LFh5w3cytxgwkJ2KmS7urE204Zh7gPBsKdN/HIEQoC814SRWejyu83yHlruLHIl7UaKccCa7K2ZnyDpsyKu.cN.I4QdV2IFt6Yw19AMM4LYVi0aiGJ3gZoGI3Q11kpptuS3Lb1qPPj4uozVYxLa6FkQdZE2buFrl7MpMQrW HTTP/1.1 

Frame 125: 322 bytes on wire (2576 bits), 322 bytes captured (2576 bits) on interface 0
Ethernet II, Src: Vmware_37:bb:e5 (00:0c:29:37:bb:e5), Dst: Vmware_51:c3:5c (00:0c:29:51:c3:5c)
Internet Protocol Version 4, Src: 192.168.133.134, Dst: 192.168.133.128
Transmission Control Protocol, Src Port: 41284, Dst Port: 8080, Seq: 257, Ack: 1, Len: 256
Hypertext Transfer Protocol

No.     Time           Source                Destination           Protocol Length Info
    134 15.399847433   192.168.133.134       192.168.133.128       HTTP     322    GET /GjnJ3nFKLkQJnZMSMFTWSVMhHzwvuDUGegj/hmGZDXgNEi5q6zsqAuk0lZvZhuwZmhjubFotKiLyVwHaoYHUUr9uyokfXFOgwPg9j7kPan79ZQLcDy.qZ32XXu6t2egvTAw7xqFSyQWYsh6wUuk7YTlBOIxC70GKVLRphqYGbaFnCthxiPQckdgEN.U.PxfaLnlzJhxF9lNb6Ko7/GsuMoalJ2NcaJVfgGzltPl68RHrhg HTTP/1.1 

Frame 134: 322 bytes on wire (2576 bits), 322 bytes captured (2576 bits) on interface 0
Ethernet II, Src: Vmware_37:bb:e5 (00:0c:29:37:bb:e5), Dst: Vmware_51:c3:5c (00:0c:29:51:c3:5c)
Internet Protocol Version 4, Src: 192.168.133.134, Dst: 192.168.133.128
Transmission Control Protocol, Src Port: 41284, Dst Port: 8080, Seq: 513, Ack: 257, Len: 256
Hypertext Transfer Protocol

No.     Time           Source                Destination           Protocol Length Info
    145 18.715029502   192.168.133.134       192.168.133.128       HTTP     322    GET /G6UCatJ2TPVgaRPnMlG0ki8gi/MzrZTYGALMxuiuST19esgBT3MCzkx8i6y5UeTBZ8yR65N.OA6uydTtsKXJc5kMqwZwzCS0g.y1.T00n.2C4FA0yL3/wxHavvkt4YBhCqZChr08UlwFYvLWLuQ34WlpDRQvWyHHgVEp3whlnO5jgL8MpjOVBgBZPtK7H7t0s/9cwT6yD9izlQI5WkQ0a9Lp9YLS8h5F6wsD5t9wVflJ4x HTTP/1.1 

Frame 145: 322 bytes on wire (2576 bits), 322 bytes captured (2576 bits) on interface 0
Ethernet II, Src: Vmware_37:bb:e5 (00:0c:29:37:bb:e5), Dst: Vmware_51:c3:5c (00:0c:29:51:c3:5c)
Internet Protocol Version 4, Src: 192.168.133.134, Dst: 192.168.133.128
Transmission Control Protocol, Src Port: 41284, Dst Port: 8080, Seq: 769, Ack: 513, Len: 256
Hypertext Transfer Protocol

No.     Time           Source                Destination           Protocol Length Info
    147 18.715793319   192.168.133.128       124.127.180.200       HTTP     135    GET / HTTP/1.1 

Frame 147: 135 bytes on wire (1080 bits), 135 bytes captured (1080 bits) on interface 0
Ethernet II, Src: Vmware_51:c3:5c (00:0c:29:51:c3:5c), Dst: Vmware_e7:51:18 (00:50:56:e7:51:18)
Internet Protocol Version 4, Src: 192.168.133.128, Dst: 124.127.180.200
Transmission Control Protocol, Src Port: 37032, Dst Port: 80, Seq: 1, Ack: 1, Len: 81
Hypertext Transfer Protocol

No.     Time           Source                Destination           Protocol Length Info
    149 19.008025150   124.127.180.200       192.168.133.128       HTTP     405    HTTP/1.1 301 Moved Permanently  (text/html)

Frame 149: 405 bytes on wire (3240 bits), 405 bytes captured (3240 bits) on interface 0
Ethernet II, Src: Vmware_e7:51:18 (00:50:56:e7:51:18), Dst: Vmware_51:c3:5c (00:0c:29:51:c3:5c)
Internet Protocol Version 4, Src: 124.127.180.200, Dst: 192.168.133.128
Transmission Control Protocol, Src Port: 80, Dst Port: 37032, Seq: 1, Ack: 82, Len: 351
Hypertext Transfer Protocol
Line-based text data: text/html

No.     Time           Source                Destination           Protocol Length Info
    155 19.013813765   192.168.133.134       192.168.133.128       HTTP     322    GET /GcUIaI9PsV0nZCqvsHw0rJKyJtltzjPmvneJ0npGRLYcB3gkMc7bCnys7i0UCRMThhoK4QcC6P.clhDQO1sgdVi8ZZ5aTYIywHb3moMN4p2/gh60MLakT.ddkNEY0QlbG9NzzTVmMbhgoRjS/VjDfMUm1tzuyO4KCsMrPEzQqDi43ybJaQAuOLcifPFBBS8Yh6H1QoBj1FvcNKuy5l2ZWCmTeCEnZ6xT1NPUET46ybCiNB HTTP/1.1 

Frame 155: 322 bytes on wire (2576 bits), 322 bytes captured (2576 bits) on interface 0
Ethernet II, Src: Vmware_37:bb:e5 (00:0c:29:37:bb:e5), Dst: Vmware_51:c3:5c (00:0c:29:51:c3:5c)
Internet Protocol Version 4, Src: 192.168.133.134, Dst: 192.168.133.128
Transmission Control Protocol, Src Port: 41288, Dst Port: 8080, Seq: 1, Ack: 1, Len: 256
Hypertext Transfer Protocol

No.     Time           Source                Destination           Protocol Length Info
    157 19.014537259   192.168.133.134       192.168.133.128       HTTP     322    GET /EJYht8q27wWdfePrPfwO9fwUAfwUm2bGObIs.RKdwYonswizIByEdJIqa34ugGoLlp9KgWrHAQmzG19xICBYth2v1uVb8LYjdqYWQksvcQLuCf1MiaRC5Bg8Tj4bNT.qyx.vdrvpT6sLE2TB.6Ac0Qw/wbiw9aGAZJuXj4dSmn2zPFGRQDp/vLfv9ihE0xywYPeCxoNStiNdoQadbboSANO0xaoKBuTkDytaUxXkES/DQ1 HTTP/1.1 

Frame 157: 322 bytes on wire (2576 bits), 322 bytes captured (2576 bits) on interface 0
Ethernet II, Src: Vmware_37:bb:e5 (00:0c:29:37:bb:e5), Dst: Vmware_51:c3:5c (00:0c:29:51:c3:5c)
Internet Protocol Version 4, Src: 192.168.133.134, Dst: 192.168.133.128
Transmission Control Protocol, Src Port: 41288, Dst Port: 8080, Seq: 257, Ack: 1, Len: 256
Hypertext Transfer Protocol

No.     Time           Source                Destination           Protocol Length Info
    165 19.043587079   192.168.133.134       192.168.133.128       HTTP     322    GET /EM5M9RsICEZHdg20Iw1KX.LLThYM47H5ZH4Kpohb/Ix65/issonv18hnWmvf2e8CpxRyI5JcqlmaPQJ.ySySjrjlSwmBJcxDKy6eSYU0eRIaEJDkxGEPRxN6l8kyCPiK1s7/yQX3l2NqAsbhicfKBUYOL4CxUvaQA3ha2KH2TGbMWkWLeNmdpZDMUTzeuGVW4wV67V6hrgv.o5mxYF/zoyls84hXeu95z9AP3754.Tu6J4 HTTP/1.1 

Frame 165: 322 bytes on wire (2576 bits), 322 bytes captured (2576 bits) on interface 0
Ethernet II, Src: Vmware_37:bb:e5 (00:0c:29:37:bb:e5), Dst: Vmware_51:c3:5c (00:0c:29:51:c3:5c)
Internet Protocol Version 4, Src: 192.168.133.134, Dst: 192.168.133.128
Transmission Control Protocol, Src Port: 41288, Dst Port: 8080, Seq: 513, Ack: 257, Len: 256
Hypertext Transfer Protocol

No.     Time           Source                Destination           Protocol Length Info
    171 19.084907441   192.168.133.134       192.168.133.128       HTTP     322    GET /G/ymhQcG7aO1/c3iCIsbk1neDKsPmfjFgFHk3RO9THNjiPw3WKdRYtzb3Kw8Vh4By5KGjcTf3Wyh2epUrsKo3u7W7LMceVJtYFXg0icpuR//o4LdOeh3JQbJqZFrBqAsnPYs9WgHDn1JZB/R7Tt4yL1fD/LEuEpAifJC5n.YfX0naWCRApHSvgF9jJzZpnXw.YzAnTpKj7UyAkHevWVK1nD29YcoVNzL7YiXJ9A7z6v5fL HTTP/1.1 

Frame 171: 322 bytes on wire (2576 bits), 322 bytes captured (2576 bits) on interface 0
Ethernet II, Src: Vmware_37:bb:e5 (00:0c:29:37:bb:e5), Dst: Vmware_51:c3:5c (00:0c:29:51:c3:5c)
Internet Protocol Version 4, Src: 192.168.133.134, Dst: 192.168.133.128
Transmission Control Protocol, Src Port: 41288, Dst Port: 8080, Seq: 769, Ack: 513, Len: 256
Hypertext Transfer Protocol

No.     Time           Source                Destination           Protocol Length Info
    172 19.085748499   192.168.133.128       82.20.175.195         HTTP     133    GET / HTTP/1.1 

Frame 172: 133 bytes on wire (1064 bits), 133 bytes captured (1064 bits) on interface 0
Ethernet II, Src: Vmware_51:c3:5c (00:0c:29:51:c3:5c), Dst: Vmware_e7:51:18 (00:50:56:e7:51:18)
Internet Protocol Version 4, Src: 192.168.133.128, Dst: 82.20.175.195
Transmission Control Protocol, Src Port: 49114, Dst Port: 80, Seq: 1, Ack: 1, Len: 79
Hypertext Transfer Protocol

No.     Time           Source                Destination           Protocol Length Info
    174 19.108151591   82.20.175.195         192.168.133.128       HTTP     243    HTTP/1.1 301 Moved Permanently 

Frame 174: 243 bytes on wire (1944 bits), 243 bytes captured (1944 bits) on interface 0
Ethernet II, Src: Vmware_e7:51:18 (00:50:56:e7:51:18), Dst: Vmware_51:c3:5c (00:0c:29:51:c3:5c)
Internet Protocol Version 4, Src: 82.20.175.195, Dst: 192.168.133.128
Transmission Control Protocol, Src Port: 80, Dst Port: 49114, Seq: 1, Ack: 80, Len: 189
Hypertext Transfer Protocol

No.     Time           Source                Destination           Protocol Length Info
    180 19.112869136   192.168.133.134       192.168.133.128       HTTP     322    GET /GmDwKSd/Vgnm9d8HnGqX0wLNTTu0iS1ftf6X.ogy4fcLU/X87yeljdcQAURsQBiRVH0zqGbLvnWp9I7L5V4pktRfTEDKmur0SRmtEq4IYmNUxhcQJfJT3Ra217c0gB5Bsp1BPlAhzTYvMcik99memf1wnL.oOnNkuIl141.vD7OdN5FU4xCYMLrMc/FPDoUHjOGwugP8UWjqFDgpPeEIbQ.1VthIfhrQOAJHUK8wP2VRTl HTTP/1.1 

Frame 180: 322 bytes on wire (2576 bits), 322 bytes captured (2576 bits) on interface 0
Ethernet II, Src: Vmware_37:bb:e5 (00:0c:29:37:bb:e5), Dst: Vmware_51:c3:5c (00:0c:29:51:c3:5c)
Internet Protocol Version 4, Src: 192.168.133.134, Dst: 192.168.133.128
Transmission Control Protocol, Src Port: 41292, Dst Port: 8080, Seq: 1, Ack: 1, Len: 256
Hypertext Transfer Protocol

No.     Time           Source                Destination           Protocol Length Info
    182 19.113528859   192.168.133.134       192.168.133.128       HTTP     322    GET /G6ceOGGfFHq12vTw5HXIczGoMup4IkTKLeeJ85ppxzKSjC96SnfARXjzcleEsbbBvAkh3Q8dnGBFESbVVJ5dW01FPb/1X3zBHxqLlP2SPTU1kONanuy.5Dvnxlr8LrRijO9bT8U0Tkavo7D8oxbtVInNRFTdzRKlknTXhaSZyRR4hw6yzIjd3HC5M4S0cmVIdzsdUIcDaAaQyRhiQ9EPl.BEnxvq0rgaPw/z9kGhn06vmz HTTP/1.1 

Frame 182: 322 bytes on wire (2576 bits), 322 bytes captured (2576 bits) on interface 0
Ethernet II, Src: Vmware_37:bb:e5 (00:0c:29:37:bb:e5), Dst: Vmware_51:c3:5c (00:0c:29:51:c3:5c)
Internet Protocol Version 4, Src: 192.168.133.134, Dst: 192.168.133.128
Transmission Control Protocol, Src Port: 41292, Dst Port: 8080, Seq: 257, Ack: 1, Len: 256
Hypertext Transfer Protocol

No.     Time           Source                Destination           Protocol Length Info
    190 19.145022670   192.168.133.134       192.168.133.128       HTTP     322    GET /GVufkbnQnKJVNIb8AQSQvrwkxFCySOZbWIAgqVBLNAWq8jYJ7I4PTqoHMkS3tyoNjq3X264t9rM5/oaathpVjqY2tBgEQGE8dYhyW8CqSJzsfHkqqFsIJbx0N.C1sdcuivUNTl/UGgSchDH.gkaU.5i.0p9SnQZOxQqnrjfzkKvfBfcrXLcQFdKPLCqs9Ha/bL4lvmbEFcumrzEz.dKhKITzc6H83vSW.MQfqStfLk61cQ HTTP/1.1 

Frame 190: 322 bytes on wire (2576 bits), 322 bytes captured (2576 bits) on interface 0
Ethernet II, Src: Vmware_37:bb:e5 (00:0c:29:37:bb:e5), Dst: Vmware_51:c3:5c (00:0c:29:51:c3:5c)
Internet Protocol Version 4, Src: 192.168.133.134, Dst: 192.168.133.128
Transmission Control Protocol, Src Port: 41292, Dst Port: 8080, Seq: 513, Ack: 257, Len: 256
Hypertext Transfer Protocol

No.     Time           Source                Destination           Protocol Length Info
    197 19.244670587   192.168.133.134       192.168.133.128       HTTP     322    GET //wlm0KTOXhIm9c/tp1v4GYsNAkwQF81kwDYd.VlTGvRewp74e9RzBzfnVA7AuVVIdvOVMQxyWlFWbgmECazcK9SsdCqKGqKaWa3oMsYwVpXKiVI9QAxcVH4zV5jvViADJVOpZaPyxgkgxcogJc63qv6JQUiSE/0rVPvOXufOx2gCvFSpQhbEJTabxbXdOTR4hlBDNd0FNuKH3cUi4rLZvV87XMD9jnko.SzgxHq4brGgV2 HTTP/1.1 

Frame 197: 322 bytes on wire (2576 bits), 322 bytes captured (2576 bits) on interface 0
Ethernet II, Src: Vmware_37:bb:e5 (00:0c:29:37:bb:e5), Dst: Vmware_51:c3:5c (00:0c:29:51:c3:5c)
Internet Protocol Version 4, Src: 192.168.133.134, Dst: 192.168.133.128
Transmission Control Protocol, Src Port: 41292, Dst Port: 8080, Seq: 769, Ack: 513, Len: 256
Hypertext Transfer Protocol

No.     Time           Source                Destination           Protocol Length Info
    199 19.245550099   192.168.133.128       195.8.215.136         HTTP     133    GET / HTTP/1.1 

Frame 199: 133 bytes on wire (1064 bits), 133 bytes captured (1064 bits) on interface 0
Ethernet II, Src: Vmware_51:c3:5c (00:0c:29:51:c3:5c), Dst: Vmware_e7:51:18 (00:50:56:e7:51:18)
Internet Protocol Version 4, Src: 192.168.133.128, Dst: 195.8.215.136
Transmission Control Protocol, Src Port: 56928, Dst Port: 80, Seq: 1, Ack: 1, Len: 79
Hypertext Transfer Protocol

No.     Time           Source                Destination           Protocol Length Info
    201 19.295292457   195.8.215.136         192.168.133.128       HTTP     232    HTTP/1.1 301 Moved Permanently 

Frame 201: 232 bytes on wire (1856 bits), 232 bytes captured (1856 bits) on interface 0
Ethernet II, Src: Vmware_e7:51:18 (00:50:56:e7:51:18), Dst: Vmware_51:c3:5c (00:0c:29:51:c3:5c)
Internet Protocol Version 4, Src: 195.8.215.136, Dst: 192.168.133.128
Transmission Control Protocol, Src Port: 80, Dst Port: 56928, Seq: 1, Ack: 80, Len: 178
Hypertext Transfer Protocol

No.     Time           Source                Destination           Protocol Length Info
    205 19.297965517   192.168.133.128       192.168.133.134       HTTP     66     HTTP/1.1 200 OK  (h)

Frame 205: 66 bytes on wire (528 bits), 66 bytes captured (528 bits) on interface 0
Ethernet II, Src: Vmware_51:c3:5c (00:0c:29:51:c3:5c), Dst: Vmware_37:bb:e5 (00:0c:29:37:bb:e5)
Internet Protocol Version 4, Src: 192.168.133.128, Dst: 192.168.133.134
Transmission Control Protocol, Src Port: 8080, Dst Port: 41268, Seq: 1169, Ack: 1026, Len: 0
[4 Reassembled TCP Segments (1168 bytes): #14(256), #25(256), #32(656), #205(0)]
Hypertext Transfer Protocol
Media Type

No.     Time           Source                Destination           Protocol Length Info
    210 19.299539466   192.168.133.134       192.168.133.128       HTTP     322    GET /GFYlPOaPeCXWMBtcD0P1I3lw.BYhEbb6wlwJjzKoTgoj9nv2413QdbbqqsyuRaN3KzeGvaXvKnfl1AJoALjFLGYMMRkaGGzV/PJ0n5vIZwnGrLqg0YTT1wxrBHC4aamXN/XnGW39j/syRubRP4b5aPmVh4jqc9D2r1okm4dgxZRFNlo326ZXPOxsG4icyBkCh40TWLAlAROoy5hQCdXeFHIWKfzyegQi2RSCGg7PnsJa9V HTTP/1.1 

Frame 210: 322 bytes on wire (2576 bits), 322 bytes captured (2576 bits) on interface 0
Ethernet II, Src: Vmware_37:bb:e5 (00:0c:29:37:bb:e5), Dst: Vmware_51:c3:5c (00:0c:29:51:c3:5c)
Internet Protocol Version 4, Src: 192.168.133.134, Dst: 192.168.133.128
Transmission Control Protocol, Src Port: 41296, Dst Port: 8080, Seq: 1, Ack: 1, Len: 256
Hypertext Transfer Protocol

No.     Time           Source                Destination           Protocol Length Info
    212 19.300713154   192.168.133.134       192.168.133.128       HTTP     322    GET //0.fU8tBkJKZcHjVm3KyiZkFnXWbAimAChKevPHrbyLyjduEoUh19OAUaCPh.u.HsWre/USpbD0uyAAMlQD3u7L/QK9EgFdGLPcBArLaOIiJswlFs.6K0fh2h1FdezuWy8l6/SdaKE2YFWZMby73lXXdcN7ALA7Okr6l2s0fXA56j8oA3nt3c1iEGjNNLnZ2B4c2Ebe.M7clMNySpDOVxRlBZmvOWyqf8NvJ5QgU9mvUxz HTTP/1.1 

Frame 212: 322 bytes on wire (2576 bits), 322 bytes captured (2576 bits) on interface 0
Ethernet II, Src: Vmware_37:bb:e5 (00:0c:29:37:bb:e5), Dst: Vmware_51:c3:5c (00:0c:29:51:c3:5c)
Internet Protocol Version 4, Src: 192.168.133.134, Dst: 192.168.133.128
Transmission Control Protocol, Src Port: 41296, Dst Port: 8080, Seq: 257, Ack: 1, Len: 256
Hypertext Transfer Protocol

No.     Time           Source                Destination           Protocol Length Info
    225 19.637200378   192.168.133.134       192.168.133.128       HTTP     322    GET /Gio4okEAzBbocbfUcxIoCoimQYS/I5fPD7oa3a1nicJO56hi9u9diZnbaXnIBvG2PxiEoHNLftv7IBzpHklhLdh4enbeJ63fApbJ7N8gMxfS32iNpTXAcc09C/KlnV82ybK4kRXNAQuzNSTeN7pZMasZH0b2Hg14XgFFBA2XdY2vNfVK76UzNoN.I34bpQ4qWI9gjLOHv3OvGQTokrCpOdMIUh3x8nJb/FxLqCsN/chze6 HTTP/1.1 

Frame 225: 322 bytes on wire (2576 bits), 322 bytes captured (2576 bits) on interface 0
Ethernet II, Src: Vmware_37:bb:e5 (00:0c:29:37:bb:e5), Dst: Vmware_51:c3:5c (00:0c:29:51:c3:5c)
Internet Protocol Version 4, Src: 192.168.133.134, Dst: 192.168.133.128
Transmission Control Protocol, Src Port: 41296, Dst Port: 8080, Seq: 513, Ack: 257, Len: 256
Hypertext Transfer Protocol

No.     Time           Source                Destination           Protocol Length Info
    234 19.946045999   192.168.133.134       192.168.133.128       HTTP     322    GET /T8LOgHfMZVibsd3w9A2lckIsE6ymArh6sAOjgjaVxKy4L1PzaopU1nK2zCErYOvpVE71YvNDjcQOWIdpwehuVGaKEEzel5.7liVVQz4YSSbkRDPOjKu5KHW0QNvUCOFtMfAimo2b9lJFecUlgAYmF3fKkq99whNRWKGLQrUtHQAuvKwM4GvzaZwPF.jOfKNl6PY.mG80xJmSMK5ovX7YYObfWxwMt9quFri/VljP.I0wZ0 HTTP/1.1 

Frame 234: 322 bytes on wire (2576 bits), 322 bytes captured (2576 bits) on interface 0
Ethernet II, Src: Vmware_37:bb:e5 (00:0c:29:37:bb:e5), Dst: Vmware_51:c3:5c (00:0c:29:51:c3:5c)
Internet Protocol Version 4, Src: 192.168.133.134, Dst: 192.168.133.128
Transmission Control Protocol, Src Port: 41296, Dst Port: 8080, Seq: 769, Ack: 513, Len: 256
Hypertext Transfer Protocol

No.     Time           Source                Destination           Protocol Length Info
    236 19.948172460   192.168.133.128       203.133.167.16        HTTP     126    GET / HTTP/1.1 

Frame 236: 126 bytes on wire (1008 bits), 126 bytes captured (1008 bits) on interface 0
Ethernet II, Src: Vmware_51:c3:5c (00:0c:29:51:c3:5c), Dst: Vmware_e7:51:18 (00:50:56:e7:51:18)
Internet Protocol Version 4, Src: 192.168.133.128, Dst: 203.133.167.16
Transmission Control Protocol, Src Port: 35406, Dst Port: 80, Seq: 1, Ack: 1, Len: 72
Hypertext Transfer Protocol

No.     Time           Source                Destination           Protocol Length Info
    238 20.247997630   203.133.167.16        192.168.133.128       HTTP     187    HTTP/1.1 302 Found : Moved Temporarily 

Frame 238: 187 bytes on wire (1496 bits), 187 bytes captured (1496 bits) on interface 0
Ethernet II, Src: Vmware_e7:51:18 (00:50:56:e7:51:18), Dst: Vmware_51:c3:5c (00:0c:29:51:c3:5c)
Internet Protocol Version 4, Src: 203.133.167.16, Dst: 192.168.133.128
Transmission Control Protocol, Src Port: 80, Dst Port: 35406, Seq: 1, Ack: 73, Len: 133
Hypertext Transfer Protocol

No.     Time           Source                Destination           Protocol Length Info
    242 20.270433745   192.168.133.128       192.168.133.134       HTTP     66     HTTP/1.1 200 OK  (h)

Frame 242: 66 bytes on wire (528 bits), 66 bytes captured (528 bits) on interface 0
Ethernet II, Src: Vmware_51:c3:5c (00:0c:29:51:c3:5c), Dst: Vmware_37:bb:e5 (00:0c:29:37:bb:e5)
Internet Protocol Version 4, Src: 192.168.133.128, Dst: 192.168.133.134
Transmission Control Protocol, Src Port: 8080, Dst Port: 41296, Seq: 769, Ack: 1025, Len: 0
[4 Reassembled TCP Segments (768 bytes): #214(256), #232(256), #239(256), #242(0)]
Hypertext Transfer Protocol
Media Type

No.     Time           Source                Destination           Protocol Length Info
    248 20.273196067   192.168.133.134       192.168.133.128       HTTP     322    GET /Ed2U5w5AIuMzR4upoaA/sgQo3762nDX22PT8Mrx/QNTO/AoB.j8bwcqdSP2My0ep59J.H252VRolE300YJevF6HRMl3edTqwANt9B9PCA5K2fg.TGvrxrRoRelcuO7YiUUq8wKdc6jUaaMV.PvbZGGFZ.9QpdoKXFsuKWXRUjvEQD6sdOZ7JycMOgEIRnra2FMK2xeyNSFi77e0R.RRAVVTizz2hErFlCuZ8fKhGe499PD HTTP/1.1 

Frame 248: 322 bytes on wire (2576 bits), 322 bytes captured (2576 bits) on interface 0
Ethernet II, Src: Vmware_37:bb:e5 (00:0c:29:37:bb:e5), Dst: Vmware_51:c3:5c (00:0c:29:51:c3:5c)
Internet Protocol Version 4, Src: 192.168.133.134, Dst: 192.168.133.128
Transmission Control Protocol, Src Port: 41300, Dst Port: 8080, Seq: 1, Ack: 1, Len: 256
Hypertext Transfer Protocol

No.     Time           Source                Destination           Protocol Length Info
    250 20.274395985   192.168.133.134       192.168.133.128       HTTP     322    GET /T2Cpmy10PlBA1AXMSpn1ynvhx//.b/3Spvx51MOK0EoDs/Wldbde2bvujNFCl19nRYzXhZtAj5HQhf/cLbC20fDk9v7a6AYUCwQIdw2JowsDDrCCjHcNYhoi8EXbB3dl6mm9esw.QWV66G0ehAHf5xMdwUoT0A31TRM0.m3hJ854fUNtAT7mvMzZV10/spzmNrDr58QDQMdt.2xQhFk7aCYkHtGYavakPXJRKtCjhNlxXo HTTP/1.1 

Frame 250: 322 bytes on wire (2576 bits), 322 bytes captured (2576 bits) on interface 0
Ethernet II, Src: Vmware_37:bb:e5 (00:0c:29:37:bb:e5), Dst: Vmware_51:c3:5c (00:0c:29:51:c3:5c)
Internet Protocol Version 4, Src: 192.168.133.134, Dst: 192.168.133.128
Transmission Control Protocol, Src Port: 41300, Dst Port: 8080, Seq: 257, Ack: 1, Len: 256
Hypertext Transfer Protocol

No.     Time           Source                Destination           Protocol Length Info
    258 20.292412342   192.168.133.134       192.168.133.128       HTTP     322    GET /GckkyBujyZq4RzZE1mo3tJ59kBzuNezSTUTDiOuXg10U3quLSYB3m2MdOFhYo8hAdG4KVuOeqXWYglCAFXOJ7zxdKn366uhYTmjcUeUmlSG985m7mvFfK36tC8UfohAbYHh0pORomMXvoQBIGz8VC.BXgOtb7VL5oZR5UcFJa3532QUK5.aF8Klg.A5SMU3MabZ3RJdHNyTpoEp5ydfUHHxBDu81TgxW/RcAdQ.NFPgenl HTTP/1.1 

Frame 258: 322 bytes on wire (2576 bits), 322 bytes captured (2576 bits) on interface 0
Ethernet II, Src: Vmware_37:bb:e5 (00:0c:29:37:bb:e5), Dst: Vmware_51:c3:5c (00:0c:29:51:c3:5c)
Internet Protocol Version 4, Src: 192.168.133.134, Dst: 192.168.133.128
Transmission Control Protocol, Src Port: 41300, Dst Port: 8080, Seq: 513, Ack: 257, Len: 256
Hypertext Transfer Protocol

No.     Time           Source                Destination           Protocol Length Info
    264 20.573287986   192.168.133.134       192.168.133.128       HTTP     322    GET /Evgxdv9Y2G.gFRdSEfzaVWLXSvV2eU91r6qmF00hG0fJS08GLMoWVncpfLx.8XmgiunZwtTrbTTy1T3xnZ..m1HZdyAgMY0ADFZygkg8YqZRA.nwArE2RTKmZtB1/BNq14TxGzMWyBhFpt5sA9MvteEHKRF1BVRAjhIZY9o.Aus//tEk4tvN9EnJr4.rnTvB0O/FyjVQkzmP9SqKZzOOl.odT22NGUEgdMJ6x2QmGVldz4 HTTP/1.1 

Frame 264: 322 bytes on wire (2576 bits), 322 bytes captured (2576 bits) on interface 0
Ethernet II, Src: Vmware_37:bb:e5 (00:0c:29:37:bb:e5), Dst: Vmware_51:c3:5c (00:0c:29:51:c3:5c)
Internet Protocol Version 4, Src: 192.168.133.134, Dst: 192.168.133.128
